{
  "title": "Course 5: Prompt Engineering — Chihuahuas in the Time of AI",
  "slug": "course-5-quiz",
  "course": "prompt-engineering",
  "description": "Test your understanding of prompt engineering techniques — from foundational prompting principles to advanced strategies for marketing, legal, financial, and data analysis workflows.",
  "questions": [
    {
      "id": 1,
      "scenario": "Your company just deployed Claude for all 500 employees in your professional services firm. After two weeks, you notice wildly inconsistent results: some teams rave about AI-generated client proposals while others complain the outputs are 'useless generic filler.' Both groups are using the same AI model. You pull sample prompts from each group to investigate.",
      "question": "What is the most likely explanation for the inconsistent results across teams?",
      "choices": [
        "The AI model performs better for certain industries and worse for others — teams with poor results should switch to a different model",
        "The teams producing poor results are using vague, unstructured prompts without role context, format specifications, or examples — while the successful teams are using detailed, well-crafted prompts",
        "The teams with poor results have slower internet connections, which degrades AI output quality",
        "AI performance is inherently random — inconsistent results are normal and cannot be improved through training"
      ],
      "correctIndex": 1,
      "explanation": "Research from Boston Consulting Group found that output quality varied by up to 40% based solely on how workers phrased their requests. The four components of effective prompts — role/context, task specification, format constraints, and examples — are what separate useful outputs from generic filler. Same model, same data, dramatically different results based on prompt quality."
    },
    {
      "id": 2,
      "scenario": "You're a VP of Sales preparing for a board meeting. You ask AI: 'What are the biggest risks to our Q4 revenue target?' The AI generates a confident, well-written response listing five risks with supporting arguments. You notice the response includes a statistic claiming 'Gartner predicts 45% of enterprise software deals will slip from Q4 to Q1 in 2025' — a very specific claim you've never seen before.",
      "question": "What should you do about this specific statistic before including it in your board presentation?",
      "choices": [
        "Include it — AI models are trained on real data, so the statistic is almost certainly accurate",
        "Verify the statistic independently against the original source, because LLMs can generate plausible-sounding but fabricated facts, citations, and statistics",
        "Remove all statistics from the AI output and replace them with your own — AI is unreliable with numbers",
        "Ask the AI if the statistic is accurate — it will correct itself if the original response was wrong"
      ],
      "correctIndex": 1,
      "explanation": "LLM hallucination is a well-documented phenomenon — Stanford HAI found that AI hallucinated verifiable facts in 3-5% of business-context responses, and users failed to catch hallucinations 60% of the time. Specific statistics with named sources are particularly risky because they sound authoritative. The correct approach is independent verification against the cited source. Asking the AI to self-verify is unreliable — it may simply reaffirm its own fabrication."
    },
    {
      "id": 3,
      "scenario": "A private equity firm needs to evaluate an acquisition target. An associate suggests using AI to 'analyze the target company and tell us if we should buy it.' The managing director knows this single-prompt approach won't produce useful due diligence. She wants to design a prompt chain instead.",
      "question": "What is the correct structure for a cumulative prompt chain for this due diligence analysis?",
      "choices": [
        "Send one comprehensive prompt that includes all financial data, market data, and the analysis request — modern AI can handle complex multi-part tasks in a single prompt",
        "Start with a foundation prompt to extract and organize financial data, then an analysis prompt to identify risks and patterns, then a market context prompt to benchmark against peers, then a synthesis prompt to draft the investment memo — each building on the previous output",
        "Run the same analysis prompt five times and average the results to reduce AI variability",
        "Use AI only for the final memo writing — have humans do all the analysis manually and use AI to format the output"
      ],
      "correctIndex": 1,
      "explanation": "Cumulative prompting breaks complex tasks into sequential steps: foundation prompts extract and organize data, analysis prompts identify patterns and risks, and synthesis prompts produce actionable deliverables. Each step builds on the last, producing depth that no single prompt can achieve. Accenture found that consulting teams using structured prompt chains completed deliverables 40% faster than teams using ad-hoc single prompts."
    },
    {
      "id": 4,
      "scenario": "Your marketing team is using AI to generate blog content for SEO. After three months, organic traffic from AI-generated posts is flat — despite publishing twice as much content as before. A competitor publishing half as many posts is outranking you consistently. You audit both your prompts and your competitor's content.",
      "question": "What is the most likely cause of your poor SEO performance despite increased AI-generated content volume?",
      "choices": [
        "Google's algorithm penalizes all AI-generated content — you should stop using AI for content creation entirely",
        "Your prompts likely produce generic content without specific keyword targeting, search intent alignment, or original insights — while your competitor uses AI to enhance original thinking and research rather than replace it",
        "You need to publish even more content to outrank competitors — volume always wins in SEO",
        "The AI model you're using is inferior for SEO content — switching to a different model will fix the rankings"
      ],
      "correctIndex": 1,
      "explanation": "Google's March 2024 core update targeted low-quality AI-generated content, reducing visibility by up to 40% for sites publishing generic AI output. HubSpot found that AI-generated content only outperformed in SEO when prompts included specific keyword targets and search intent guidance. The winning approach is using AI to accelerate original thinking — not to mass-produce generic content."
    },
    {
      "id": 5,
      "scenario": "Your legal team is reviewing a 50-page vendor contract. A junior attorney uses AI to identify risky provisions and produces a detailed analysis in 30 minutes — work that would typically take 4 hours. The senior partner reviews the AI output and finds it identified 8 out of 10 genuinely problematic provisions, but also flagged 3 provisions as 'high risk' that are actually market-standard terms.",
      "question": "What does this result tell you about the appropriate role of AI in legal contract review?",
      "choices": [
        "AI caught 80% of the issues in 12.5% of the time — the false positives are an acceptable trade-off and human review is unnecessary",
        "AI is unreliable for legal work — the false positives prove it shouldn't be used for contract review",
        "AI is effective as an accelerator for the first-pass review, significantly reducing time while catching most issues — but attorney verification of AI findings remains essential before any output is shared with clients or used for decisions",
        "The junior attorney should refine the prompt until AI achieves 100% accuracy before using it for any future reviews"
      ],
      "correctIndex": 2,
      "explanation": "Allen & Overy reported that their AI tool Harvey reduced initial contract review time by 50%, but emphasized that every AI-generated review undergoes attorney verification. Thomson Reuters found material errors in approximately 15% of AI-generated legal research. AI accelerates the first pass — it does not replace professional judgment. The 80% hit rate with significant time savings is valuable, but the remaining review and false positive correction is where professional expertise remains essential."
    },
    {
      "id": 6,
      "scenario": "You ask AI to help analyze your company's quarterly financial performance. Your prompt is: 'Our revenue was $12M in Q1 with 20% growth, and Q2 growth was 15%. What's our Q2 revenue?' The AI responds immediately with '$14.4M.' You suspect this might be wrong.",
      "question": "What prompting technique would most improve the accuracy of this financial calculation?",
      "choices": [
        "Ask the same question three times and take the most common answer",
        "Use chain-of-thought prompting — ask the AI to 'think step by step, showing your calculations at each stage' so you can verify each step of the reasoning",
        "Add 'please be accurate' to the prompt — this instruction improves mathematical performance",
        "Switch to a larger AI model — mathematical errors are purely a function of model size"
      ],
      "correctIndex": 1,
      "explanation": "The correct answer is $13.8M ($12M × 1.15 = $13.8M). The AI likely applied 20% growth to $12M instead of recognizing that $12M already reflects Q1 growth. Chain-of-thought prompting, introduced by Wei et al. (2022), forces the model to show each calculation step, making errors visible and verifiable. This technique improved accuracy on math problems by over 40% in research studies. For financial analysis, always require the AI to show its work."
    },
    {
      "id": 7,